{"schema":"history-hour.v1","hour_utc":"2026-10-12T16:00:00Z","complete":false,"sampling":"newest_fix_per_vehicle_per_minute","vehicles":[{"operator":"rio-brt","vehicle":"7002","mode":"brt","line":"ESP01"},{"operator":"rio-brt","vehicle":"7004","mode":"brt","line":"ESP01"},{"operator":"rio-brt","vehicle":"803027","mode":"brt","line":"54"},{"operator":"rio-brt","vehicle":"803034","mode":"brt","line":"54"},{"operator":"rio-brt","vehicle":"901051","mode":"brt","line":"51"},{"operator":"rio-brt","vehicle":"902036","mode":"brt","line":"0"},{"operator":"rio-brt","vehicle":"902036","mode":"brt","line":"46"},{"operator":"rio-brt","vehicle":"902091","mode":"brt","line":"40"},{"operator":"rio-sistema-rio","vehicle":"A2-001","mode":"bus","line":"898"},{"operator":"rio-sistema-rio","vehicle":"A2-003","mode":"bus","line":null},{"operator":"rio-sistema-rio","vehicle":"A2-004","mode":"bus","line":null},{"operator":"rio-sistema-rio","vehicle":"A2-004","mode":"bus","line":"840"},{"operator":"rio-sistema-rio","vehicle":"A2-012","mode":"bus","line":null},{"operator":"rio-sistema-rio","vehicle":"A2-017","mode":"bus","line":null},{"operator":"rio-sistema-rio","vehicle":"A2-019","mode":"bus","line":null},{"operator":"rio-sistema-rio","vehicle":"A2-028","mode":"bus","line":null},{"operator":"rio-sppo","vehicle":"A29004","mode":"bus","line":"160"},{"operator":"rio-sppo","vehicle":"A29010","mode":"bus","line":"160"},{"operator":"rio-sppo","vehicle":"A29021","mode":"bus","line":"350"},{"operator":"rio-sppo","vehicle":"A29025","mode":"bus","line":"160"}],"fixes":{"v":[0,0,0,0,0,0,0,0,0,0,0,0,0,0,0,0,0,0,0,0,0,0,0,0,0,1,1,1,1,1,1,1,1,1,1,1,1,1,1,1,1,1,1,1,1,1,1,1,1,1,2,2,2,2,2,2,2,2,2,2,2,2,2,2,2,2,2,2,2,2,2,3,3,3,3,3,3,3,3,3,3,3,3,3,3,3,3,3,3,3,3,3,3,3,3,3,4,4,4,4,4,4,4,4,4,4,4,4,4,4,4,4,4,4,4,4,4,4,4,5,6,6,6,6,6,6,6,6,6,6,6,6,6,6,6,6,6,6,6,6,6,6,6,6,7,7,7,7,7,7,7,7,7,7,7,7,7,7,7,7,7,7,7,7,7,8,8,8,8,8,8,8,8,8,8,8,8,8,8,8,8,8,8,8,8,8,8,8,8,8,9,9,9,9,9,9,9,9,9,9,9,9,9,9,9,9,9,9,10,10,11,11,11,11,11,11,11,11,11,11,11,11,11,11,11,11,11,11,11,11,11,12,12,12,12,12,12,12,12,12,12,12,12,12,12,12,12,12,12,12,12,12,12,12,12,12,13,13,13,13,13,13,13,13,13,13,13,13,13,13,13,13,13,13,13,13,13,13,13,13,13,14,14,14,14,14,14,14,14,14,14,14,14,14,14,14,14,14,15,15,16,16,16,16,16,16,16,16,16,16,16,16,16,16,16,16,16,16,16,16,16,16,16,16,16,17,17,17,17,17,17,17,17,17,17,17,17,17,17,17,17,17,17,17,17,17,17,17,18,18,18,18,18,18,18,18,18,18,18,18,18,18,18,18,18,18,18,18,18,18,18,18,18,19,19,19,19,19,19,19,19,19,19,19,19,19,19,19],"t":[47,108,167,227,287,348,408,467,527,587,648,707,767,827,888,947,1007,1067,1128,1192,1247,1307,1368,1428,1457,43,104,163,223,283,343,403,463,523,583,643,683,763,823,883,943,1003,1063,1123,1183,1255,1303,1363,1423,1463,279,339,399,460,520,580,639,669,759,820,880,939,999,1030,1139,1199,1229,1289,1379,1439,1469,44,104,164,223,284,344,404,464,524,584,644,701,759,819,879,939,999,1059,1119,1179,1239,1299,1359,1419,1479,57,117,178,238,298,343,418,451,526,590,650,713,773,818,945,1013,1074,1125,1233,1294,1373,1408,1454,1257,55,115,175,235,295,355,415,476,536,596,656,716,776,836,896,942,1017,1077,1137,1197,1317,1377,1437,1483,46,118,175,237,266,349,418,479,537,568,657,692,776,834,885,938,1016,1072,1086,1158,1481,59,119,179,238,298,355,419,479,538,599,654,717,765,825,898,950,1018,1079,1136,1193,1259,1319,1368,1439,1495,58,119,172,235,298,358,418,478,538,585,664,838,958,1078,1198,1318,1437,1495,0,81,151,211,271,331,391,451,536,596,655,715,767,832,892,959,1014,1068,1139,1197,1258,1302,1372,46,91,136,226,271,316,406,451,496,586,631,676,766,811,890,935,980,1070,1115,1160,1250,1295,1340,1430,1475,45,90,135,225,270,315,405,450,495,585,630,675,765,810,855,945,990,1035,1125,1170,1215,1305,1350,1395,1485,45,90,135,225,270,315,405,469,533,596,716,833,953,1073,1193,1313,1433,169,204,54,115,176,238,294,354,414,474,534,594,654,714,774,834,894,954,1014,1074,1134,1196,1257,1319,1374,1434,1494,169,229,290,350,411,472,534,595,657,719,763,827,882,942,1014,1063,1126,1182,1244,1306,1367,1429,1491,51,113,174,236,298,350,410,470,530,590,650,710,770,830,890,950,1010,1070,1132,1192,1255,1315,1377,1438,1468,57,119,167,236,287,347,407,467,520,819,1256,1315,1372,1434,1490],"lat":[-2281434,-2281459,-2281464,-2281497,-2282020,-2282650,-2283424,-2284106,-2284684,-2285158,-2285438,-2285807,-2286708,-2287502,-2288265,-2288661,-2288827,-2289034,-2289718,-2289842,-2289928,-2289933,-2289934,-2289934,-2289934,-2281461,-2281383,-2281420,-2281427,-2281431,-2281436,-2281439,-2281440,-2281441,-2281443,-2281442,-2281432,-2281435,-2281439,-2281435,-2281434,-2281430,-2281434,-2281434,-2281461,-2281477,-2281594,-2282108,-2282810,-2283344,-2297196,-2297201,-2297201,-2297201,-2297200,-2297202,-2297202,-2297202,-2297202,-2297202,-2297202,-2297202,-2297202,-2297202,-2297211,-2297212,-2297212,-2297212,-2297213,-2297213,-2297214,-2296649,-2296649,-2296649,-2296649,-2296649,-2296649,-2296649,-2296649,-2296649,-2296649,-2296649,-2296649,-2296644,-2296643,-2296645,-2296649,-2296299,-2295932,-2295591,-2295426,-2295132,-2294740,-2294490,-2294243,-2294155,-2285349,-2285686,-2286002,-2286229,-2286448,-2286655,-2286847,-2286969,-2287627,-2287863,-2288578,-2288793,-2289559,-2290021,-2291588,-2292035,-2292820,-2292978,-2294141,-2294638,-2295045,-2295328,-2295521,-2300182,-2295739,-2295871,-2296003,-2296054,-2296803,-2297297,-2297328,-2297323,-2297342,-2297344,-2297419,-2298028,-2298899,-2299756,-2300145,-2300145,-2300145,-2300144,-2300139,-2300101,-2300201,-2300201,-2300201,-2300201,-2294789,-2294972,-2295581,-2295879,-2295976,-2295999,-2296738,-2297112,-2297291,-2297326,-2297335,-2297337,-2297342,-2297688,-2298355,-2298547,-2299666,-2300139,-2300138,-2300140,-2300118,-2295600,-2295383,-2294977,-2294624,-2294331,-2293974,-2293905,-2293594,-2293211,-2292818,-2292600,-2292426,-2292180,-2292178,-2292181,-2292103,-2291949,-2291604,-2291481,-2291630,-2291255,-2290898,-2290669,-2290261,-2290015,-2290168,-2290128,-2290088,-2290066,-2290066,-2290066,-2290066,-2290066,-2290066,-2290066,-2290066,-2290066,-2290066,-2290066,-2290066,-2290066,-2290067,-2290067,-2288947,-2288947,-2288947,-2288947,-2288947,-2288947,-2288947,-2288947,-2288947,-2288947,-2288947,-2288947,-2288947,-2288947,-2288947,-2288945,-2289006,-2289178,-2289408,-2289664,-2290012,-2290120,-2290260,-2288239,-2288239,-2288239,-2288239,-2288239,-2288239,-2288239,-2288239,-2288239,-2288239,-2288239,-2288239,-2288239,-2288239,-2288239,-2288239,-2288239,-2288239,-2288239,-2288239,-2288239,-2288239,-2288239,-2288239,-2288239,-2288236,-2288236,-2288236,-2288236,-2288236,-2288236,-2288236,-2288236,-2288236,-2288236,-2288236,-2288236,-2288236,-2288236,-2288236,-2288236,-2288236,-2288236,-2288236,-2288236,-2288236,-2288236,-2288236,-2288236,-2288236,-2288227,-2288227,-2288227,-2288227,-2288227,-2288227,-2288227,-2288231,-2288214,-2288214,-2288214,-2288214,-2288214,-2288214,-2288214,-2288214,-2288214,-2288237,-2288239,-2296808,-2297501,-2297611,-2297817,-2297948,-2298171,-2298452,-2298486,-2298505,-2298477,-2298304,-2298201,-2298005,-2297867,-2297818,-2297774,-2297635,-2297430,-2297220,-2296970,-2296768,-2296511,-2296296,-2296309,-2296281,-2289924,-2289925,-2289923,-2289902,-2289898,-2289898,-2289898,-2289898,-2289898,-2289897,-2290078,-2290639,-2290729,-2290860,-2291127,-2291152,-2291237,-2291306,-2291394,-2291866,-2292703,-2293483,-2293921,-2289105,-2289376,-2289437,-2289146,-2288790,-2288579,-2288880,-2289326,-2289872,-2289859,-2289569,-2289494,-2289452,-2289365,-2289527,-2289882,-2290184,-2290296,-2290699,-2290631,-2290662,-2291030,-2290982,-2290919,-2290901,-2293424,-2292625,-2291976,-2291092,-2290702,-2290413,-2290044,-2289920,-2289912,-2289910,-2289920,-2289885,-2290209,-2290201,-2289827],"lon":[-4324650,-4324618,-4324617,-4324309,-4323510,-4323323,-4323895,-4323953,-4324300,-4324856,-4324983,-4324781,-4324761,-4324329,-4323760,-4323007,-4322312,-4321732,-4321293,-4321154,-4321048,-4321037,-4321036,-4321036,-4321036,-4324619,-4324455,-4324657,-4324659,-4324658,-4324657,-4324664,-4324664,-4324662,-4324661,-4324667,-4324667,-4324663,-4324661,-4324664,-4324666,-4324659,-4324662,-4324662,-4324630,-4324597,-4324164,-4323369,-4323459,-4323811,-4340073,-4340069,-4340069,-4340069,-4340064,-4340064,-4340064,-4340064,-4340064,-4340064,-4340064,-4340064,-4340064,-4340064,-4340076,-4340079,-4340079,-4340079,-4340076,-4340076,-4340078,-4333554,-4333554,-4333554,-4333554,-4333554,-4333554,-4333554,-4333554,-4333554,-4333554,-4333554,-4333554,-4333556,-4333555,-4333554,-4333553,-4333493,-4333541,-4333689,-4333757,-4333875,-4333963,-4333994,-4334113,-4334150,-4338557,-4339022,-4339632,-4340080,-4340562,-4341004,-4341359,-4341171,-4340503,-4340091,-4340070,-4340099,-4339942,-4339744,-4339792,-4339667,-4339595,-4339521,-4339464,-4339381,-4338989,-4339072,-4339228,-4336760,-4338018,-4338395,-4338957,-4338988,-4339075,-4338579,-4338358,-4338120,-4337228,-4336639,-4336367,-4336567,-4336588,-4336629,-4336739,-4336714,-4336714,-4336715,-4336463,-4336683,-4336602,-4336604,-4336604,-4336604,-4337237,-4337299,-4337813,-4338448,-4338850,-4338948,-4339064,-4338834,-4338586,-4338276,-4337743,-4337182,-4336633,-4336494,-4336578,-4336588,-4336593,-4336793,-4336728,-4336630,-4336419,-4368827,-4368420,-4368130,-4368147,-4368320,-4368563,-4368610,-4368825,-4368895,-4369044,-4369029,-4368677,-4368420,-4368413,-4368199,-4368106,-4367965,-4367991,-4368213,-4368493,-4368675,-4368632,-4368462,-4368167,-4367985,-4356068,-4356080,-4356091,-4356017,-4356017,-4356017,-4356017,-4356016,-4356016,-4356016,-4356016,-4356016,-4356016,-4356016,-4356016,-4356016,-4356019,-4356019,-4371686,-4371686,-4371686,-4371684,-4371684,-4371684,-4371684,-4371684,-4371684,-4371684,-4371684,-4371684,-4371684,-4371684,-4371684,-4371689,-4371751,-4371852,-4372020,-4372104,-4372204,-4372247,-4371919,-4362507,-4362507,-4362507,-4362507,-4362507,-4362507,-4362507,-4362507,-4362507,-4362507,-4362507,-4362507,-4362507,-4362507,-4362507,-4362507,-4362507,-4362507,-4362507,-4362507,-4362507,-4362507,-4362507,-4362507,-43625